{
  "event_id": "00000000-0000-4000-8000-000000000001",
  "schema_version": 1,
  "report_run_id": "00000000-0000-4000-8000-000000000002",
  "batch_id": "00000000-0000-4000-8000-000000000003",
  "selection_snapshot_id": "00000000-0000-4000-8000-000000000004",
  "batch_no": 1,
  "item_count": 200,
  "policy_snapshot_ref": "policy://tenant-current/v17",
  "trace_id": "trace-contract-fixture",
  "occurred_at": "2026-09-04T12:00:00Z"
}
